{
  "$schema": "reports/review-audit.v1.schema.json",
  "schemaVersion": "1",
  "generatedAt": "2026-06-25T08:00:00Z",
  "period": "2026-05-26 – 2026-06-25",
  "sourceReport": {
    "reportJsonUri": "reports/report.json",
    "reportSchemaUri": "reports/report.v2.schema.json",
    "reportSchemaVersion": "2",
    "reportGeneratedAt": "2026-06-25T07:45:00Z",
    "reportTitle": "AI PR Review Report"
  },
  "summary": {
    "reviewCount": 18,
    "findingCount": 47,
    "reviewsWithFindings": 12,
    "downstreamImpactReviewCount": 5,
    "resultCounts": {
      "approved": 11,
      "changes-requested": 5,
      "commented": 2
    },
    "totalTokensUsed": 1840000,
    "estimatedCostUsd": 9.20,
    "feedbackCollectionStatus": "partial",
    "humanReplyCount": 7,
    "acceptedOrThankedCount": 5,
    "falsePositiveClaimedCount": 1,
    "noObservedReplyCount": 11
  },
  "reviews": [
    {
      "id": "audit-001",
      "prNumber": 1247,
      "prTitle": "feat: add FHIR R4 patient search endpoint",
      "repository": "carecontinuity/api-gateway",
      "workspace": "carecontinuity",
      "repoSlug": "api-gateway",
      "branch": "feat/fhir-patient-search",
      "authorPresent": true,
      "reviewedAt": "2026-06-24T14:30:00Z",
      "timeToReviewMs": 48000,
      "accuracyRating": 79,
      "result": "changes-requested",
      "hats": ["dotnet-service", "data-persistence", "interfacing"],
      "findingCount": 6,
      "tokensUsed": 142000,
      "estimatedCostUsd": 0.71,
      "aicCreditsUsed": 14.2,
      "model": "gpt-4o",
      "provider": "azure",
      "modelsUsedCount": 2,
      "jiraTicketKey": "CC-2891",
      "downstreamImpact": {
        "triggered": true,
        "contractCount": 3,
        "referenceCount": 8,
        "hasBreakingChanges": false
      },
      "feedback": {
        "collectionStatus": "complete",
        "botCommentCount": 6,
        "humanReplyCount": 4,
        "firstHumanReplyAt": "2026-06-24T16:15:00Z",
        "labels": ["ai-reviewed"],
        "threadResolvedCount": 4,
        "commitsAfterBotComment": 2
      },
      "improvementSignals": {
        "hasFindingDetails": true,
        "findingDetailsSource": "hatDetails",
        "downstreamImpactTriggered": true,
        "hasModelTelemetry": true,
        "hasCostTelemetry": true
      }
    },
    {
      "id": "audit-002",
      "prNumber": 1243,
      "prTitle": "fix: resolve race condition in appointment booking flow",
      "repository": "carecontinuity/patient-portal",
      "workspace": "carecontinuity",
      "repoSlug": "patient-portal",
      "branch": "fix/appointment-race-condition",
      "authorPresent": true,
      "reviewedAt": "2026-06-23T09:15:00Z",
      "timeToReviewMs": 62000,
      "accuracyRating": 94,
      "result": "approved",
      "hats": ["portals-react", "e2e-playwright"],
      "findingCount": 3,
      "tokensUsed": 98000,
      "estimatedCostUsd": 0.49,
      "aicCreditsUsed": 9.8,
      "model": "gpt-4o",
      "provider": "azure",
      "modelsUsedCount": 1,
      "jiraTicketKey": "CC-2877",
      "downstreamImpact": null,
      "feedback": {
        "collectionStatus": "partial",
        "botCommentCount": 3,
        "humanReplyCount": 1,
        "firstHumanReplyAt": "2026-06-23T11:00:00Z",
        "labels": ["ai-reviewed", "approved"],
        "threadResolvedCount": 1,
        "commitsAfterBotComment": 1
      },
      "improvementSignals": {
        "hasFindingDetails": true,
        "findingDetailsSource": "hatDetails",
        "downstreamImpactTriggered": false,
        "hasModelTelemetry": true,
        "hasCostTelemetry": true
      }
    },
    {
      "id": "audit-003",
      "prNumber": 1238,
      "prTitle": "chore: update CI pipeline to use new runner images",
      "repository": "carecontinuity/infra",
      "workspace": "carecontinuity",
      "repoSlug": "infra",
      "branch": "chore/ci-runner-update",
      "authorPresent": false,
      "reviewedAt": "2026-06-22T11:00:00Z",
      "timeToReviewMs": 31000,
      "accuracyRating": 61,
      "result": "commented",
      "hats": ["ci-automation"],
      "findingCount": 1,
      "tokensUsed": 55000,
      "estimatedCostUsd": 0.28,
      "aicCreditsUsed": 5.5,
      "model": "gpt-4o-mini",
      "provider": "azure",
      "modelsUsedCount": 1,
      "jiraTicketKey": null,
      "downstreamImpact": null,
      "feedback": {
        "collectionStatus": "not-collected",
        "botCommentCount": 1,
        "humanReplyCount": 0,
        "firstHumanReplyAt": null,
        "labels": ["ai-reviewed"],
        "threadResolvedCount": 0,
        "commitsAfterBotComment": 0
      },
      "improvementSignals": {
        "hasFindingDetails": true,
        "findingDetailsSource": "bitbucket",
        "downstreamImpactTriggered": false,
        "hasModelTelemetry": true,
        "hasCostTelemetry": true
      }
    },
    {
      "id": "audit-004",
      "prNumber": 1232,
      "prTitle": "feat: care team messaging — read receipts and delivery status",
      "repository": "carecontinuity/patient-portal",
      "workspace": "carecontinuity",
      "repoSlug": "patient-portal",
      "branch": "feat/messaging-read-receipts",
      "authorPresent": true,
      "reviewedAt": "2026-06-21T15:45:00Z",
      "timeToReviewMs": 89000,
      "accuracyRating": 88,
      "result": "changes-requested",
      "hats": ["portals-react", "data-persistence", "design-review"],
      "findingCount": 9,
      "tokensUsed": 187000,
      "estimatedCostUsd": 0.94,
      "aicCreditsUsed": 18.7,
      "model": "gpt-4o",
      "provider": "azure",
      "modelsUsedCount": 2,
      "jiraTicketKey": "CC-2861",
      "downstreamImpact": {
        "triggered": true,
        "contractCount": 2,
        "referenceCount": 5,
        "hasBreakingChanges": false
      },
      "feedback": {
        "collectionStatus": "complete",
        "botCommentCount": 9,
        "humanReplyCount": 2,
        "firstHumanReplyAt": "2026-06-21T17:30:00Z",
        "labels": ["ai-reviewed", "needs-work"],
        "threadResolvedCount": 2,
        "commitsAfterBotComment": 3
      },
      "improvementSignals": {
        "hasFindingDetails": true,
        "findingDetailsSource": "hatDetails",
        "downstreamImpactTriggered": true,
        "hasModelTelemetry": true,
        "hasCostTelemetry": true
      }
    },
    {
      "id": "audit-005",
      "prNumber": 1225,
      "prTitle": "refactor: extract shared auth middleware from portal and admin",
      "repository": "carecontinuity/shared-libs",
      "workspace": "carecontinuity",
      "repoSlug": "shared-libs",
      "branch": "refactor/shared-auth-middleware",
      "authorPresent": true,
      "reviewedAt": "2026-06-20T10:00:00Z",
      "timeToReviewMs": 54000,
      "accuracyRating": 73,
      "result": "approved",
      "hats": ["dotnet-service", "dotnet-best-practices", "interfacing"],
      "findingCount": 4,
      "tokensUsed": 121000,
      "estimatedCostUsd": 0.61,
      "aicCreditsUsed": 12.1,
      "model": "gpt-4o",
      "provider": "azure",
      "modelsUsedCount": 1,
      "jiraTicketKey": "CC-2850",
      "downstreamImpact": {
        "triggered": true,
        "contractCount": 5,
        "referenceCount": 12,
        "hasBreakingChanges": true
      },
      "feedback": {
        "collectionStatus": "complete",
        "botCommentCount": 4,
        "humanReplyCount": null,
        "firstHumanReplyAt": null,
        "labels": ["ai-reviewed"],
        "threadResolvedCount": null,
        "commitsAfterBotComment": 1
      },
      "improvementSignals": {
        "hasFindingDetails": true,
        "findingDetailsSource": "hatDetails",
        "downstreamImpactTriggered": true,
        "hasModelTelemetry": true,
        "hasCostTelemetry": true
      }
    }
  ]
}
